<?xml version = '1.0'?>
<?xml-stylesheet type="text/xsl" href="../xslt/fcs_html.xsl"?>
<!DOCTYPE fate-core SYSTEM "../fcs.dtd">
<fcs>
  <id>
    <charname>Zird the Arcane</charname>
    <playername>sample FATE Core character</playername>
    <description>A sharp-featured scholar with a dark triangular beard.</description>
  </id>
  <refresh>2</refresh>
  <current-fate-points>2</current-fate-points>
  <aspects>
    <aspect type="high_concept">Wizard for Hire</aspect>
    <aspect type="trouble">Rivals in the Collegia Arcana</aspect>
    <aspect>If I Haven't Been There, I've Read About It</aspect>
    <aspect>Not The Face!</aspect>
    <aspect>Doesn't Suffer Fools Gladly</aspect>
  </aspects>
  <skills>
    <skill rating="4" name="Lore"/>
    <skill rating="3" name="Rapport"/>
    <skill rating="3" name="Crafts"/>
    <skill rating="2" name="Athletics"/>
    <skill rating="2" name="Will"/>
    <skill rating="2" name="Investigate"/>
    <skill rating="1" name="Fight"/>
    <skill rating="1" name="Resources"/>
    <skill rating="1" name="Contacts"/>
    <skill rating="1" name="Notice"/>
  </skills>
  <extras>
    <extra>Collegia Arcana Mage</extra>
  </extras>
  <stunts>
    <stunt effect="Can make Physical Recovery attempts w/Lore">Scholar, Healer</stunt>
  </stunts>
  <consequences>
    <consequence severity="mild">mild one</consequence>
  </consequences>
</fcs>
